{
  "description": "reflection-report.md 输出规范",
  "outputFormat": "markdown",
  "document": {
    "title": "反思报告 — {{ runId }}",
    "titleFormat": "动态拼接",
    "description": "检查项目未完结项、推荐后续动作与本次 run 经验教训。",
    "separators": true
  },
  "sections": [
    {
      "heading": "未完结项（Open items）",
      "level": 2,
      "required": true,
      "format": "structured-list",
      "idPrefix": "",
      "idPattern": "[ ]",
      "extensible": true,
      "description": "targetDir 中的 TODO/FIXME/XXX 标记，每条用 - [ ] 开头"
    },
    {
      "heading": "推荐后续动作（Follow-ups）",
      "level": 2,
      "required": true,
      "format": "list",
      "extensible": true,
      "description": "可执行的后续任务列表"
    },
    {
      "heading": "本次 run 经验（Lessons learned）",
      "level": 2,
      "required": true,
      "format": "list",
      "extensible": true,
      "description": "本次 run 的经验教训"
    },
    {
      "heading": "与原始 requirement 的偏差",
      "level": 2,
      "required": true,
      "format": "prose",
      "extensible": false,
      "description": "与原始需求的偏差说明，若完全匹配则写「无」"
    },
    {
      "heading": "用户确认",
      "level": 2,
      "required": true,
      "format": "template",
      "extensible": false,
      "content": "请确认以下任一选项：\n\n- ✅ **同意**：本 reflection 符合预期，可标记本次 run 为 **Done**。\n- ❌ **修改**：请在下方/对话中列出需要调整的条目与意见，AI 将基于反馈重新生成本文档。"
    }
  ],
  "rules": [
    "未完结项每条必须引用文件路径和行号",
    "后续动作必须是可执行的任务描述，不得是自由文本",
    "与原始 requirement 的偏差：若无偏差写「无」",
    "用户确认 section 文本不得修改"
  ],
  "example": "# 反思报告 — run-20260624-001\n\n> 检查项目未完结项、推荐后续动作与本次 run 经验教训。\n\n---\n\n## 未完结项（Open items）\n\n> 来源：targetDir 中的 TODO / FIXME / XXX 标记，以及本 run 未完成的任务。\n\n- [ ] src/api/theme.js:42 — 缺少异常处理\n- [ ] src/components/Header.jsx:18 — 主题切换动画待优化\n\n---\n\n## 推荐后续动作（Follow-ups）\n\n- 为 theme.js 添加 try-catch 异常处理\n- 实现主题切换的 CSS transition 动画\n\n---\n\n## 本次 run 经验（Lessons learned）\n\n- CSS 变量方案比 JS 内联样式更适合主题切换\n- 需要提前规划 localStorage 的 key 命名\n\n---\n\n## 与原始 requirement 的偏差\n\n无\n\n---\n\n## 用户确认\n\n请确认以下任一选项：\n\n- ✅ **同意**：本 reflection 符合预期，可标记本次 run 为 **Done**。\n- ❌ **修改**：请在下方/对话中列出需要调整的条目与意见，AI 将基于反馈重新生成本文档。",
  "fieldDocs": {
    "sections[].format": "内容格式类型。structured-list=带复选框标记的结构化列表（未完结项）；list=无序列表（后续动作、经验教训）；prose=完整段落叙述（偏差说明）；template=固定模板文本（用户确认）",
    "sections[].extensible": "是否允许 agent 扩展。未完结项/后续动作/经验教训 true（条目数随实际情况变化）；偏差说明/用户确认 false（结构固定）",
    "sections[].idPrefix": "structured-list 的 ID 前缀。未完结项无前缀，直接以 - [ ] 开头",
    "sections[].idPattern": "ID 生成模式。未完结项使用 [ ] 复选框模式，每条格式为 - [ ] file:line — 描述",
    "sections[].content": "template 格式的固定文本内容，用户确认 section 必须原样输出",
    "document.titleFormat": "标题格式。动态拼接=固定文本「反思报告 — 」+ runId，如 \"反思报告 — run-20260624-001\"",
    "sections[0].format": "未完结项使用 structured-list 格式，扫描 targetDir 中的 TODO/FIXME/XXX 标记，每条引用文件路径和行号",
    "sections[1].format": "推荐后续动作使用 list 格式，每条必须是可执行的任务描述，不得是自由文本",
    "sections[2].format": "经验教训使用 list 格式，记录本次 run 中的技术选型、踩坑、最佳实践等",
    "sections[3].format": "与原始 requirement 的偏差使用 prose 格式。若完全匹配则写「无」，否则说明具体偏差",
    "sections[4].content": "用户确认固定模板，提供同意/修改两个选项。同意后可标记 run 为 Done，agent 不得修改此文本"
  }
}
