{
  "description": "worktree-info.json 输出规范（审计登记产物：state 不读取，注册由 git-info 推断完成）。字段对齐 prompt v2 的 kebab 关键词命名规则。",
  "outputFormat": "json",
  "document": {
    "title": "工作树信息",
    "titleFormat": "固定文本",
    "description": "本次 run 的 git 工作树创建登记信息。",
    "separators": false
  },
  "jsonFields": [
    {
      "name": "branchName",
      "type": "string",
      "required": true,
      "description": "完整的分支名（type 前缀 + kebab 关键词）",
      "example": "feat/add-dark-mode"
    },
    {
      "name": "worktreePath",
      "type": "string",
      "required": true,
      "description": "工作树的绝对路径",
      "example": "/Users/user/projects/Ddo-Code-Flow-feat-add-dark-mode"
    },
    {
      "name": "worktreeDir",
      "type": "string",
      "required": true,
      "description": "worktree 落盘父目录（空配置时为主检出项目根父目录）的绝对路径",
      "example": "/Users/user/projects"
    },
    {
      "name": "type",
      "type": "string",
      "required": true,
      "description": "分支前缀（如 feat、fix）",
      "example": "feat"
    },
    {
      "name": "baseRef",
      "type": "string",
      "required": true,
      "description": "创建分支的基准引用（如 main 或配置的发布分支）",
      "example": "main"
    },
    {
      "name": "createdAt",
      "type": "string",
      "required": true,
      "description": "创建时间（ISO 8601 格式）",
      "example": "2026-06-24T10:00:00Z"
    }
  ],
  "sections": [
    {
      "heading": "基本信息",
      "level": 2,
      "required": true,
      "format": "table",
      "columns": ["字段", "值"],
      "extensible": false,
      "description": "将 JSON 每个字段渲染为一行两列的表格"
    }
  ],
  "rules": [
    "worktreePath 必须是绝对路径",
    "type 必须是有效的分支前缀（feat/fix/chore/docs/refactor/test/perf/ci/build）",
    "createdAt 必须是 ISO 8601 格式"
  ],
  "example": "{\n  \"branchName\": \"feat/add-dark-mode\",\n  \"worktreePath\": \"/Users/user/projects/Ddo-Code-Flow-feat-add-dark-mode\",\n  \"worktreeDir\": \"/Users/user/projects\",\n  \"type\": \"feat\",\n  \"baseRef\": \"main\",\n  \"createdAt\": \"2026-06-24T10:00:00Z\"\n}",
  "fieldDocs": {
    "jsonFields": "JSON 结构化字段定义。每个字段对应 worktree-info.json 中的一个顶层属性",
    "jsonFields[].branchName": "完整的 git 分支名，遵循 type/kebab-keywords 命名规范（≤50 字符关键词）",
    "jsonFields[].worktreePath": "git worktree 的绝对路径，由 git worktree add 自动生成",
    "jsonFields[].worktreeDir": "worktree 落盘父目录的绝对路径，从有效配置解析而来；空配置时为主检出项目根父目录",
    "jsonFields[].type": "分支类型前缀，取值范围：feat/fix/chore/docs/refactor/test/perf/ci/build",
    "jsonFields[].baseRef": "创建分支的基准引用：single 场景为仓库主分支，release-dev 场景为 base_branch 配置",
    "jsonFields[].createdAt": "工作树创建时间，ISO 8601 格式",
    "sections[].format": "内容格式类型。table=两列表格（字段名/值），用于将 JSON 字段渲染为可读的键值对",
    "sections[].columns": "表格列定义。固定为 [\"字段\", \"值\"]，第一列为 JSON 字段名，第二列为对应值",
    "sections[].extensible": "是否允许 agent 扩展。false 表示严格按 jsonFields 定义渲染，不增减行",
    "document.titleFormat": "标题格式。固定文本=原样输出「工作树信息」"
  }
}
