{
  "description": "详细技术 Plan 输出规范；支持 single 和 split 两种文档模式，并可派生简化归档文档。",
  "outputFormat": "markdown",
  "document": {
    "title": "{{ 项目名称 }} 技术 Plan",
    "titleFormat": "占位符",
    "description": "以仓库事实、技术决策和实现契约指导 Test-Planning、Tasking、Coding、Verification 与 Review。",
    "separators": true
  },
  "sections": [
    {
      "heading": "执行摘要",
      "level": 2,
      "required": true,
      "format": "prose",
      "description": "说明目标、范围、关键结论、文档模式和 revision。"
    },
    {
      "heading": "范围与非目标",
      "level": 2,
      "required": true,
      "format": "table",
      "columns": [
        "事项",
        "说明",
        "AI 索引"
      ],
      "description": "只覆盖当前仓库/服务和直接依赖；不写人员、排期或无关服务内部设计。"
    },
    {
      "heading": "现有设计与复用基线",
      "level": 2,
      "required": true,
      "format": "table",
      "columns": [
        "能力",
        "文件路径",
        "符号",
        "证据类型",
        "采用方式",
        "适用边界",
        "AI 索引"
      ],
      "description": "证据类型仅允许 Repository Fact / Assumption；采用方式仅允许 复用现有实现 / 扩展现有实现 / 新增实现 / 不适用。"
    },
    {
      "heading": "整体架构与流程",
      "level": 2,
      "required": true,
      "format": "group",
      "description": "仅描述当前改动直接相关的参与方、边界和主/异常流程；正式图使用 Mermaid flowchart 语法。"
    },
    {
      "heading": "技术选型与方案对比",
      "level": 2,
      "required": true,
      "format": "table",
      "columns": [
        "方案",
        "来源",
        "仓库适配性",
        "代价与风险",
        "状态",
        "结论",
        "AI 索引"
      ],
      "description": "只比较真实候选，不强制凑方案数量。候选来源仅限 初始 Plan / 用户修改；状态取 candidate / accepted / rejected / superseded。"
    },
    {
      "heading": "数据模型设计",
      "level": 2,
      "required": true,
      "format": "group",
      "subsections": [
        {
          "heading": "实体与字段",
          "level": 3,
          "required": true,
          "format": "prose"
        },
        {
          "heading": "schema 与 DDL（如适用）",
          "level": 3,
          "required": true,
          "format": "prose"
        },
        {
          "heading": "状态与不变量",
          "level": 3,
          "required": true,
          "format": "prose"
        },
        {
          "heading": "迁移、兼容与回滚",
          "level": 3,
          "required": true,
          "format": "prose"
        }
      ]
    },
    {
      "heading": "API 接口设计",
      "level": 2,
      "required": true,
      "format": "table",
      "columns": [
        "接口/入口",
        "请求",
        "响应",
        "错误与幂等",
        "复用标准",
        "实现职责",
        "AI 索引"
      ]
    },
    {
      "heading": "算法设计",
      "level": 2,
      "required": true,
      "format": "group",
      "description": "仅对非平凡逻辑说明输入、输出、不变量、步骤、复杂度和边界；不得提供逐行实现。"
    },
    {
      "heading": "文件变更计划",
      "level": 2,
      "required": true,
      "format": "table",
      "columns": [
        "文件/目录",
        "变更职责",
        "复用或依赖",
        "AI 索引"
      ]
    },
    {
      "heading": "兼容、稳定性与回滚",
      "level": 2,
      "required": true,
      "format": "table",
      "columns": [
        "关注点",
        "适用性",
        "设计/理由",
        "回滚信号",
        "AI 索引"
      ]
    },
    {
      "heading": "Verification Anchor",
      "level": 2,
      "required": true,
      "format": "table",
      "columns": [
        "需验证契约",
        "可观察结果",
        "证据位置",
        "AI 索引"
      ],
      "description": "只交付验证锚点，不生成测试用例或 test-plan。"
    },
    {
      "heading": "开放问题与 Spec 对应",
      "level": 2,
      "required": true,
      "format": "table",
      "columns": [
        "问题",
        "确定答案或阻塞原因",
        "解决位置",
        "AI 索引"
      ]
    },
    {
      "heading": "风险与下游交接",
      "level": 2,
      "required": true,
      "format": "group",
      "description": "说明风险、缓解、Tasking/Coding 读取范围和事实失效处理。"
    },
    {
      "heading": "用户确认",
      "level": 2,
      "required": true,
      "format": "list",
      "description": "固定指令集：同意 / 修改：<反馈> / 提问：<问题> / 归档 / 归档：<模板名>。"
    }
  ],
  "rules": [
    "数据模型设计必须位于 API 接口设计之前，API 接口设计必须位于算法设计之前",
    "FR/AC/DEC/Q 等 AI 索引不得作为表格第一列，人类可读信息在前、AI 索引置于表格末列或段落尾部",
    "所有正式图使用 Mermaid 流程图语法",
    "Plan 不承担完整测试计划职责",
    "不得新增 Plan 专属验证脚本",
    "文档模式：草稿字符数（normalized LF Unicode code point）≤ split 阈值（默认 12000，最小 4000）时为 single 模式——plan.md 包含完整详细 Plan，不创建 plans/，不得把旧分册标记为 current；超过阈值时为 split 模式——plan.md 是稳定入口和唯一确认入口，分册置于 plans/ 并按 plans/NN-<语义slug>.md 命名，按语义拆分且不切断 Markdown 表格、Mermaid、Decision、接口、schema 或 DDL 契约，旧 revision 分册必须移出 current 集合或标记 stale",
    "split 模式下入口文档必须含 Parts Manifest 表（列：#、文档、职责、字符数、状态、AI 索引），列出全部 current 分册、职责、字符数和 revision；current/stale 为状态标记",
    "归档指令：归档 仅列出可用模板名不产出文档；归档：<模板名> 只在 atom-tasks/plan/references/ 内按文件名精确解析（拒绝目录段、通配符与穿越路径），产出 tech-design.md 并在产物中记录模板名与 Plan revision；模板内容只读；归档不驱动下游，Plan revision 变化后归档文档视为 stale",
    "静态校验仅覆盖 Markdown 与 Mermaid 结构，每 revision 至多执行 1 次，失败不自动重试、不自动重载上下文（失败类型：content_error / checker_execution_error）"
  ]
}
