{
  "description": "unit-test-report.md（单元测试报告）的结构规范：执行模式、逐用例结果、结论与失败项",
  "outputFormat": "markdown",
  "document": {
    "title": "单元测试报告",
    "titleFormat": "固定文本",
    "separators": true
  },
  "sections": [
    {
      "heading": "执行模式",
      "level": 2,
      "required": true,
      "format": "list",
      "description": "测试性能优先（串行，每次执行 1-3 条）或效率优先（并行）；标注与计划所选是否一致"
    },
    {
      "heading": "用例结果",
      "level": 2,
      "required": true,
      "format": "table",
      "columns": ["用例", "结果", "证据"],
      "description": "逐条对应单元测试计划中的用例；串行模式按批次分组呈现"
    },
    {
      "heading": "结论与失败项",
      "level": 2,
      "required": true,
      "format": "text",
      "description": "通过情况汇总与失败项清单（无失败则明确说明）"
    }
  ],
  "rules": [
    "计划中每条用例必须有对应结果行，不得遗漏或新增计划外用例充数",
    "失败项如实记录（含错误摘要），不得粉饰为通过"
  ]
}
